{
  "version": "block-1",
  "fighter_id": "karate",
  "name": "Aya Quinn",
  "combat_identity": "Karate range triad",
  "dimensions": {
    "hands": "hands.hands_down",
    "defense": "defense.outfight",
    "stance": "stance.bladed",
    "tie": "tie.anti_grappling",
    "target": "target.mixer",
    "kicking": "kicking.karate",
    "mentality": "mentality.outboxer"
  },
  "adaptation": "mma",
  "orientation": "switching",
  "slot_count": 3,
  "slot_label": "Triad",
  "synchronized_capabilities": [
    {
      "id": "karate.slot.1",
      "capabilities": [
        "karate"
      ],
      "description": "Trained synchronized bundle: karate"
    },
    {
      "id": "karate.slot.2",
      "capabilities": [
        "boxing",
        "switch_step"
      ],
      "description": "Trained synchronized bundle: boxing, switch_step"
    },
    {
      "id": "karate.slot.3",
      "capabilities": [
        "anti_grappling"
      ],
      "description": "Trained synchronized bundle: anti_grappling"
    }
  ],
  "baseline_capabilities": [
    "basic_movement",
    "untrained_striking"
  ],
  "tempo": 2,
  "preferred_ranges": [
    "kick",
    "punch"
  ],
  "debt_sentence": "Use the side kick and angle exit before being crowded; the exposed lead leg must escape pressure.",
  "exploitable_seams": [
    "debt.hands.hands_down.head_straight",
    "debt.hands.hands_down.head_hook",
    "debt.defense.outfight.wall",
    "debt.defense.outfight.tempo",
    "debt.stance.bladed.leg",
    "debt.stance.bladed.entry",
    "debt.tie.anti_grappling.tempo",
    "debt.tie.anti_grappling.head_straight",
    "debt.target.mixer.recovery",
    "debt.target.mixer.tempo",
    "debt.kicking.karate.single_support",
    "debt.kicking.karate.leg",
    "debt.mentality.outboxer.wall",
    "debt.mentality.outboxer.tempo"
  ],
  "active_techniques": [
    "step",
    "retreat",
    "pivot",
    "switch_step",
    "feint",
    "jab",
    "cross",
    "hook",
    "body_hook",
    "uppercut",
    "haymaker",
    "parry",
    "shell_block",
    "slip",
    "side_kick",
    "sprawl",
    "pummel"
  ],
  "conditional_abilities": [],
  "combat_limitations": [
    "Listed grappling requires the documented range and connection.",
    "No technique is guaranteed against an active defense."
  ],
  "fighting_description": {
    "does": "Use the side kick and angle exit before being crowded.",
    "wins": "Reach kick, punch and use Karate range triad.",
    "avoids": "Unrecovered support and opponent control of the next range.",
    "beaten_by": "the exposed lead leg must escape pressure."
  },
  "appearance": {
    "clothing": "silver shorts",
    "identity_anchor": "Aya Quinn / Karate range triad",
    "props": []
  },
  "provenance": {
    "classification": "CANON",
    "label": "[CANON]",
    "source": "Supplied mandatory identity where specified; all other details authored for this release."
  }
}
