{
  "version": "block-1",
  "fighter_id": "thai",
  "name": "Niran Sol",
  "combat_identity": "Muay Thai clinch triad",
  "dimensions": {
    "hands": "hands.long_guard",
    "defense": "defense.check_frame",
    "stance": "stance.upright",
    "tie": "tie.thai_plum",
    "target": "target.knee_clincher",
    "kicking": "kicking.muay_thai",
    "mentality": "mentality.boxer_puncher"
  },
  "adaptation": "mma",
  "orientation": "orthodox",
  "slot_count": 3,
  "slot_label": "Triad",
  "synchronized_capabilities": [
    {
      "id": "thai.slot.1",
      "capabilities": [
        "boxing"
      ],
      "description": "Trained synchronized bundle: boxing"
    },
    {
      "id": "thai.slot.2",
      "capabilities": [
        "kickboxing"
      ],
      "description": "Trained synchronized bundle: kickboxing"
    },
    {
      "id": "thai.slot.3",
      "capabilities": [
        "clinch"
      ],
      "description": "Trained synchronized bundle: clinch"
    }
  ],
  "baseline_capabilities": [
    "basic_movement",
    "untrained_striking"
  ],
  "tempo": 3,
  "preferred_ranges": [
    "kick",
    "clinch"
  ],
  "debt_sentence": "Teep into a collar tie and body knee; high clinch arms leave a level-change opening.",
  "exploitable_seams": [
    "debt.hands.long_guard.clinch",
    "debt.hands.long_guard.body",
    "debt.defense.check_frame.single_support",
    "debt.defense.check_frame.body",
    "debt.stance.upright.entry",
    "debt.stance.upright.body",
    "debt.tie.thai_plum.entry",
    "debt.tie.thai_plum.body",
    "debt.target.knee_clincher.entry",
    "debt.target.knee_clincher.head_straight",
    "debt.kicking.muay_thai.entry",
    "debt.kicking.muay_thai.single_support",
    "debt.mentality.boxer_puncher.tempo",
    "debt.mentality.boxer_puncher.entry"
  ],
  "active_techniques": [
    "step",
    "retreat",
    "pivot",
    "feint",
    "jab",
    "cross",
    "hook",
    "body_hook",
    "uppercut",
    "haymaker",
    "parry",
    "shell_block",
    "slip",
    "check",
    "low_kick",
    "body_kick",
    "teep",
    "pummel",
    "collar_tie",
    "knee_body",
    "body_lock"
  ],
  "conditional_abilities": [],
  "combat_limitations": [
    "Listed grappling requires the documented range and connection.",
    "No technique is guaranteed against an active defense."
  ],
  "fighting_description": {
    "does": "Teep into a collar tie and body knee.",
    "wins": "Reach kick, clinch and use Muay Thai clinch triad.",
    "avoids": "Unrecovered support and opponent control of the next range.",
    "beaten_by": "high clinch arms leave a level-change opening."
  },
  "appearance": {
    "clothing": "ochre shorts",
    "identity_anchor": "Niran Sol / Muay Thai clinch triad",
    "props": []
  },
  "provenance": {
    "classification": "CANON",
    "label": "[CANON]",
    "source": "Supplied mandatory identity where specified; all other details authored for this release."
  }
}
